<?xml version="1.0" encoding="UTF-8"?>
<!DOCTYPE assessment_medication_item SYSTEM "assessment_medication_item.dtd">
<assessment_medication_item>
<id>990e8400-e29b-41d4-a716-446655440004</id>
<created_at>2026-04-09T10:00:00Z</created_at>
<updated_at>2026-04-09T10:00:00Z</updated_at>
<deleted_at>2026-04-09T10:00:00Z</deleted_at>
<current_medications_id>660e8400-e29b-41d4-a716-446655440001</current_medications_id>
<medication_name>Example</medication_name>
<dose>500mg</dose>
<frequency>twice daily</frequency>
<route>oral</route>
<indication></indication>
<start_date>2026-01-15</start_date>
<sort_order>0</sort_order>
</assessment_medication_item>
